<!DOCTYPE rpt2 SYSTEM "rpt2.dtd">
<!-- Created by Proximity 4.2 -->

<rpt2>
    <class-label>
        <source>
            <source-class>kdl.prox.model2.common.sources.AttributeSource</source-class>
            <data-type>str</data-type>
            <is-continuous>false</is-continuous>
            <is-single-value>false</is-single-value>
            <source-elements>
                <item-name>actorIn</item-name>
                <attr-name>salary</attr-name>
            </source-elements>
        </source>
    </class-label>
    <rpt-body>
        <node>
            <class-label-distr>
                <distr-class>kdl.prox.model2.common.probdistributions.DiscreteProbDistribution</distr-class>
                <class-label-info class="high" count="772"/>
                <class-label-info class="low" count="610"/>
            </class-label-distr>
        </node>
    </rpt-body>
</rpt2>
